field_name_1,ticker,title,description,author,url,source,timestamp,published_at,sentiment
703256,LLY,Eli Lilly to buy Dermira in a deal valued at $1.1 billion,"Eli Lilly & Co. announced Friday a deal to buy medical dermatology company Dermira Inc. in a deal valued at $1.1 billion. Under terms of the deal, Lilly will pay $18.75 in cash for each Dermira share outstanding, a 2.2% premium to Thursday's closing price of …",Tomi Kilgore,https://www.marketwatch.com/story/eli-lilly-to-buy-dermira-in-a-deal-valued-at-11-billion-2020-01-10,Marketwatch.com,,2020-01-10T11:42:17Z,0.89
703257,LLY,Eli Lilly to buy skin disease specialist Dermira for $1.1 billion,"Eli Lilly and Co said on Friday it would buy Dermira Inc for about $1.1 billion in cash to get access to the drugmaker's skin disease drugs.",Reuters Editorial,https://www.reuters.com/article/dermira-ma-lilly-idUSL4N29F2IF,Reuters,,2020-01-10T11:37:18Z,0
703258,LLY,Lilly Announces Agreement to Acquire Dermira,"INDIANAPOLIS and MENLO PARK, Calif., Jan. 10, 2020 /PRNewswire/ -- Eli Lilly and Company (NYSE: LLY) and Dermira, Inc. (NASDAQ: DERM) today announced a definitive agreement for Lilly to acquire Dermira for $18.75 per share, or approximately $1.1 billion, in a…",,https://www.prnewswire.com/news-releases/lilly-announces-agreement-to-acquire-dermira-300984850.html,Prnewswire.com,,2020-01-10T11:30:00Z,0.82
702644,BMY,"B-MS, Sanofi Claim Hawaii is Violating Their Free Speech in Plavix Suit","Bristol-Myers Squibb (B-MS) and Sanofi filed a complaint this week in the US District Court for Hawaii to fight a lawsuit brought on by the state, which sought hundreds of millions in civil penalties for the companies’ failure to make certain statements about…",,https://www.raps.org/news-and-articles/news-articles/2020/1/b-ms-sanofi-claim-hawaii-is-violating-their-free?feed=Regulatory-Focus,Raps.org,,2020-01-09T21:49:11Z,-0.8
702645,BMY,Bristol-Myers Squibb Company (BMY) Presents at Goldman Sachs 12th Annual Healthcare CEOs Unscripted Conference (Transcript),,SA Transcripts,https://seekingalpha.com/article/4316059-bristol-myers-squibb-company-bmy-presents-goldman-sachs-12th-annual-healthcare-ceos,Seekingalpha.com,,2020-01-09T21:31:19Z,0
701788,LLY,Lilly launches new robotic drug discovery laboratory,"Eli Lilly (LLY +1.7%), in collaboration with lab automation developer Strateos, announces a new San Diego-based robotic laboratory, called the Lilly Life Sciences Studio Lab, designed to accelerate th",SA Editor Douglas W. House,https://seekingalpha.com/news/3530737-lilly-launches-new-robotic-drug-discovery-laboratory,Seekingalpha.com,,2020-01-09T16:18:12Z,0
701409,ABBV,"The Daily Biotech Pulse: Merck's Keytruda Snags Another FDA Approval, DBV Announces Positive Peanut Allergy Study Findings, Applied Genetic Soars On Trial Results",The following is a roundup of top developments in the biotech space over the last 24 hours.  Scaling The Peaks (Biotech stocks that hit 52-week highs on Jan. 8.) Allergan plc (NYSE: AGN ):  AbbVie Inc ...,,https://finance.yahoo.com/news/daily-biotech-pulse-mercks-keytruda-133954562.html,Yahoo.com,,2020-01-09T13:39:54Z,0.69
701789,LLY,"Eli Lilly and Company in Collaboration with Strateos, Inc. Launch Remote-Controlled Robotic Cloud Lab","Eli Lilly and Company (NYSE: LLY) and Strateos, Inc. today unveiled a new robotic laboratory in San Diego, California designed to accelerate the drug discovery process. The Lilly Life Sciences Studio lab was conceptualized and designed by Lilly as part of a $…",PR Newswire,https://news.yahoo.com/eli-lilly-company-collaboration-strateos-130000852.html,Yahoo.com,,2020-01-09T13:00:00Z,0
700477,BMY,Celgene backs out of $55M settlement over alleged efforts to thwart generics,Bristol-Myers Squibb (BMY +0.5%) unit Celgene has apparently backed out of a $55M settlement that it agreed to in July 2019 over its activities to delay generic encroachment on Revlimid (lenalidomide),SA Editor Douglas W. House,https://seekingalpha.com/news/3530515-celgene-backs-out-of-55m-settlement-over-alleged-efforts-to-thwart-generics,Seekingalpha.com,,2020-01-08T20:37:47Z,-0.08
700411,ABBV,"AbbVie to separate Botox in new aesthetics unit; Brent Saunders won't have role",Shares of AbbVie Inc. and Allergan plc were both up about 1% in trading on Wednesday after AbbVie announced new plans for the combined company once the pending $63 billion acquisition of Allergan closes. Allergan CEO Brent Saunders will be on the board of dir…,Jaimy Lee,https://www.marketwatch.com/story/abbvie-to-separate-botox-in-new-aesthetics-unit-brent-saunders-wont-have-role-2020-01-08,Marketwatch.com,,2020-01-08T20:20:40Z,0
699662,LLY,Polaris Partners Announces Hiring of Darren Carroll as Partner in Boston,"BOSTON--(BUSINESS WIRE)--Polaris Partners, an investment firm with a long history of partnering with repeat entrepreneurs and world-class innovators, is pleased to announce Darren Carroll has joined the firm after completing a 22-year tenure with Eli Lilly an…",,https://www.businesswire.com/news/home/20200108005230/en/Polaris-Partners-Announces-Hiring-Darren-Carroll-Partner,Businesswire.com,,2020-01-08T14:12:40Z,0.44
699322,ABBV,AbbVie sets executive team to lead company after Allergan merger,"AbbVie (NYSE:ABBV) announces a new global business, Allergan Aesthetics, which includes BOTOX Cosmetic, Juvederm and Coolsculpting body contouring, that will be led by Allergan's current SVP, U.S. Med",SA Editor Douglas W. House,https://seekingalpha.com/news/3530374-abbvie-sets-executive-team-to-lead-company-after-allergan-merger,Seekingalpha.com,,2020-01-08T13:27:51Z,0
699324,ABBV,"AbbVie Announces Leadership Team and Creation of New Business, Allergan Aesthetics, Upon Completion of Acquisition","AbbVie (NYSE: ABBV), a research-based global biopharmaceutical company, today announced the creation of a new global business, Allergan Aesthetics, an AbbVie company, and the proposed leadership team for the combined company, effective upon the expected first…",PR Newswire,https://news.yahoo.com/abbvie-announces-leadership-team-creation-130000368.html,Yahoo.com,,2020-01-08T13:00:00Z,0.74
699325,ABBV,Better Buy: AbbVie vs. Biogen,"Both of these pharma giants have encountered obstacles recently, but which of them is the better buy now?",newsfeedback@fool.com (Prosper Junior Bakiny),https://www.fool.com/investing/2020/01/08/better-buy-abbvie-vs-biogen.aspx,Fool.com,,2020-01-08T12:00:00Z,0.61
698453,LLY,Eli Lilly Veteran Enrique Conterno Named FibroGen CEO,"<p>Enrique Conterno, a 27-year veteran of Eli Lilly, has been appointed CEO of FibroGen (NASDAQ: FGEN). He is also joining the San Francisco company’s board of directors. Conterno retired from Lilly last year, where he was most recently president of Lilly USA…",Frank Vinluan,https://xconomy.com/san-francisco/2020/01/07/eli-lilly-veteran-enrique-conterno-named-fibrogen-ceo/,Xconomy.com,,2020-01-07T21:40:45Z,0
698251,ABBV,"AbbVie's Rheumatoid Arthritis Drug Receives Approval from Health Canada","It's another win for the company's highly priced blockbuster candidate.",newsfeedback@fool.com (Mark Prvulovic),https://www.fool.com/investing/2020/01/07/abbvies-rheumatoid-arthritis-drug-receives-approva.aspx,Fool.com,,2020-01-07T20:53:28Z,0.9
698454,LLY,"Facing criticism over insulin prices, drugmakers offer more affordable options","Eli Lilly and Novo Nordisk are separately offering help to people who are struggling to pay for their insulin, in a move that underscores how differently drugmakers are approaching the highly politicized topic of insulin prices.",Jaimy Lee,https://www.marketwatch.com/story/facing-criticism-over-insulin-prices-drugmakers-offer-more-affordable-options-2020-01-07,Marketwatch.com,,2020-01-07T20:18:27Z,-0.53
697491,JNJ,What’s Driving Johnson & Johnson’s Stock Price Growth?,"Johnson & Johnson’s (NYSE: JNJ) stock price grew 33% from around $105 levels by the end of 2016 to around $140 in 2019, primarily driven by revenue growth, expansion of the P/E multiple, and margins. Johnson & Johnson’s stock price growth was in line with gro…","Trefis Team, Contributor, Trefis Team, Contributor https://www.forbes.com/sites/greatspeculations/people/trefis/",https://www.forbes.com/sites/greatspeculations/2020/01/07/whats-driving-johnson--johnsons-stock-price-growth/,Forbes.com,,2020-01-07T16:00:00Z,0.64
697166,ABBV,AbbVie loses bid to reverse adverse ruling on Humira patents,"Without issuing an opinion, the U.S. Court of Appeals for the Federal Circuit affirmed a Patent Trial and Appeal Board &#40;PTAB&#41; decision invaliding three patents (Nos. 8,889,135, 9,017,680 and 9",SA Editor Douglas W. House,https://seekingalpha.com/news/3530126-abbvie-loses-bid-to-reverse-adverse-ruling-on-humira-patents,Seekingalpha.com,,2020-01-07T15:11:01Z,-0.59
697294,BMY,Celgene-Seeded PharmAkea Sells Last Fibrotic Drug Candidate to Galecto,"<p>When a group of scientists from Amira Pharmaceuticals wanted to start a new biotech after the company’s 2011 acquisition by Bristol-Myers Squibb, Celgene provided seed funding. Eventually Celgene kicked in $35 million more for a research collaboration, an …",Sarah de Crescenzo,https://xconomy.com/san-diego/2020/01/07/celgene-seeded-pharmakea-sells-last-fibrotic-drug-candidate-to-galecto/,Xconomy.com,,2020-01-07T12:34:29Z,0
696771,BMY,Evotec and Bristol-Myers expand iPSC collaboration,"Evotec SE (OTCPK:EVOTF) has received a $6M payment from Bristol-Myers Squibb (NYSE:BMY) following the decision to expand the collaboration to include additional cell lines.Evotec and Celgene, which i",Mamta Mayani,https://seekingalpha.com/news/3530014-evotec-and-bristol-myers-expand-ipsc-collaboration,Seekingalpha.com,,2020-01-07T11:47:04Z,0.56
696750,ALLY,"Here's Why I Think Ally Financial (NYSE:ALLY) Is An Interesting Stock","It's only natural that many investors, especially those who are new to the game, prefer to buy shares in 'sexy' stocks...",Simply Wall St,https://finance.yahoo.com/news/heres-why-think-ally-financial-102915946.html,Yahoo.com,,2020-01-07T10:29:15Z,0.75
696772,BMY,"Bristol-Myers Squibb Completes Divestment of Manufacturing Facility in Anagni, Italy","NEW YORK--(BUSINESS WIRE)---- $BMY--Bristol-Myers Squibb Completes Divestment of Manufacturing Facility in Anagni, Italy",,https://www.businesswire.com/news/home/20200107005282/en/Bristol-Myers-Squibb-Completes-Divestment-Manufacturing-Facility-Anagni,Businesswire.com,,2020-01-07T08:12:05Z,0
696390,LLY,"Four months after CEO's death, biotech company names Lilly vet as leader","Enrique Conterno, a 27-year veteran of Eli Lilly and Co., was named Monday as the new CEO of FibroGen Inc., stepping into a role vacated with the death of founder, chairman and CEO Thomas Neff on Aug. 25. The 64-year-old Neff died unexpectedly after the 500-e…",Ron Leuty,https://www.bizjournals.com/sanfrancisco/news/2020/01/06/fibrogen-ceo-thomas-neff-enrique-conterno-fgen-lly.html?ana=RSS&s=article_search&utm_source=feedburner&utm_medium=feed&utm_campaign=Feed%3A+bizj_sanfrancisco+%28San+Francisco+Business+Times%29,Bizjournals.com,,2020-01-06T23:03:24Z,-0.91
696387,JNJ,Final 2019 Update For The Millennial Portfolio,JNJ led the portfolio higher in December with a solid 6.1% increase for the month.ABBV was the big winner for the portfolio gaining 33% in the short 4+ months of owning the stock. ABBV was the first position I bought into for this portfolio.Initiated a positi…,Mark Roussin,https://seekingalpha.com/article/4315498-final-2019-update-for-millennial-portfolio,Seekingalpha.com,,2020-01-06T22:14:32Z,0.86
696174,ABBV,Final 2019 Update For The Millennial Portfolio,JNJ led the portfolio higher in December with a solid 6.1% increase for the month.ABBV was the big winner for the portfolio gaining 33% in the short 4+ months of owning the stock. ABBV was the first position I bought into for this portfolio.Initiated a positi…,Mark Roussin,https://seekingalpha.com/article/4315498-final-2019-update-for-millennial-portfolio,Seekingalpha.com,,2020-01-06T22:14:32Z,0.86
696268,BMY,Bristol-Myers Squibb to Present at the 38th Annual J.P. Morgan Healthcare Conference,NEW YORK--(BUSINESS WIRE)---- $BMY #BMS--Bristol-Myers Squibb to Present at the 38th Annual J.P. Morgan Healthcare Conference,,https://www.businesswire.com/news/home/20200106005136/en/Bristol-Myers-Squibb-Present-38th-Annual-J.P.-Morgan,Businesswire.com,,2020-01-06T21:27:56Z,0
696176,ABBV,One Analyst Thinks AbbVie Is Grossly Undervalued,"The stock was static in 2019, but a Wall Street veteran thinks investors are overlooking the company's outstanding pipeline and strong upward momentum Continue reading...",GuruFocus.com,https://finance.yahoo.com/news/one-analyst-thinks-abbvie-grossly-211320322.html,Yahoo.com,,2020-01-06T21:13:20Z,0.89
695501,LLY,FibroGen Appoints Enrique Conterno as Its New CEO,"The former Eli Lilly executive will be tasked with launching the biotech's anemia drug roxadustat.",newsfeedback@fool.com (Brian Orelli),https://www.fool.com/investing/2020/01/06/fibrogen-appoints-enrique-conterno-as-its-new-ceo.aspx,Fool.com,,2020-01-06T17:54:27Z,0
695754,PRGO,Perrigo buys toothbrush accessory brand,"Perrigo (PRGO -0.9%) unit Ranir has acquired Steripod, a toothbrush accessory brand that includes toothbrush protectors, kids products and tongue cleaners, from Bonfit America for an undisclosed sum.",SA Editor Douglas W. House,https://seekingalpha.com/news/3529843-perrigo-buys-toothbrush-accessory-brand,Seekingalpha.com,,2020-01-06T16:25:00Z,0
695502,LLY,"Worldwide Diabetes Insulin Delivery Pen Market Analysis, 2013-2019 & 2020-2026, Featuring Novo Nordisk, Eli Lilly, Sanofi, Owen Mumford, Ypsomed, Biocon, and Berlin-Chemie","DUBLIN, Jan. 6, 2020 /PRNewswire/ -- The ""Global Diabetes Insulin Delivery Pen Market Analysis, Trends, and Forecasts to 2026"" report has been added to ResearchAndMarkets.com's offering. The Global Diabetes Insulin Delivery Pen Market size is expected to exce…",,https://www.prnewswire.com/news-releases/worldwide-diabetes-insulin-delivery-pen-market-analysis-2013-2019--2020-2026-featuring-novo-nordisk-eli-lilly-sanofi-owen-mumford-ypsomed-biocon-and-berlin-chemie-300981541.html,Prnewswire.com,,2020-01-06T16:15:00Z,0
695538,MRK,"What Does Merck & Co., Inc.'s (NYSE:MRK) P/E Ratio Tell You?",This article is written for those who want to get better at using price to earnings ratios (P/E ratios). To keep it...,,https://finance.yahoo.com/news/does-merck-co-inc-nyse-145808299.html,Yahoo.com,,2020-01-06T14:58:08Z,0.49
695503,LLY,"If You Had Bought Eli Lilly (NYSE:LLY) Stock Five Years Ago, You Could Pocket A 88% Gain Today",Generally speaking the aim of active stock picking is to find companies that provide returns that are superior to the...,,https://finance.yahoo.com/news/had-bought-eli-lilly-nyse-142859047.html,Yahoo.com,,2020-01-06T14:28:59Z,0.86
695755,PRGO,Perrigo Advances Consumer Self-Care Growth Strategy with Ranir Subsidiary Acquisition of Steripod® Toothbrush Accessory Brand,"Perrigo Company plc (NYSE; TASE: PRGO) announced today that its Ranir subsidiary has acquired the assets of Steripod®, a leading toothbrush accessory brand and innovator in the toothbrush protector market, from Bonfit America Inc. The deal includes the Sterip…",PR Newswire,https://news.yahoo.com/perrigo-advances-consumer-self-care-140000973.html?_guc_consent_skip=1578319888,Yahoo.com,,2020-01-06T14:00:00Z,0.51
695494,JNJ,Mabpharm files NDA for Remicade biosimilar in China,"Sorrento Therapeutics' (NASDAQ:SRNE) partner Mabpharm has recently filed a marketing application in China for a biosimilar to Johnson &amp; Johnson's (NYSE:JNJ) Remicade (infliximab).The Company plan",Mamta Mayani,https://seekingalpha.com/news/3529712-mabpharm-files-application-for-remicade-biosimilar-in-china,Seekingalpha.com,,2020-01-06T12:42:59Z,0
695539,MRK,Merck teams up with Taiho Pharma and Astex Pharma in cancer,"Merck (NYSE:MRK) inks an exclusive global research collaboration and license agreement with Taiho Pharmaceutical Co., Ltd. and Otsuka Pharmaceutical Co. (OTCPK:OTSKF) unit Astex Pharmaceuticals aimed",SA Editor Douglas W. House,https://seekingalpha.com/news/3529706-merck-teams-up-taiho-pharma-and-astex-pharma-in-cancer,Seekingalpha.com,,2020-01-06T12:24:14Z,0.57
694758,BMY,"Here's Why Bristol-Myers Squibb Jumped 12.7% in December",Investors breathed a sign of relief as multiple pipeline assets from Celgene closed the year with positive updates.,newsfeedback@fool.com (Maxx Chatsko),https://www.fool.com/investing/2020/01/05/heres-why-bristol-myers-squibb-jumped-127-in-decem.aspx,Fool.com,,2020-01-06T04:26:40Z,0.81
694272,PRGO,"Perrigo wants 'uncertainty' to end over €1.64bn tax bill","Perrigo, a US pharmaceutical company headquartered in Ireland, has said it is focusing on taking some of the ""uncertainty off the table"" regarding tax cases here and across the Atlantic, including its €1.64bn one with Revenue.",Unknown,https://www.independent.ie/business/world/perrigo-wants-uncertainty-to-end-over-164bn-tax-bill-38834561.html,Independent.ie,,2020-01-05T07:00:00Z,-0.34
520493,ZTS,ATO data reveals one third of large companies pay no tax - ABC ...,"Dec 11, 2019 ... BAIN INTERNATIONAL INC, 153,104,059, 20,655,534, 6,196,660 ... ZOETIS 
AUSTRALIA PTY LIMITED, 297,105,254, 11,320,943, 2,866,196.",-,https://www.abc.net.au/news/2019-12-12/ato-corporate-tax-transparency-data-companies-no-tax-paid/11789048,abc.net.au,1578096000,2020-01-04T00:00:00Z,-0.64
520492,ZTS,"Minimizing IPO Investing Risks in 2020: The ETFs to Own | 24/7 Wall ...","Jan 3, 2020 ... ... National Information Services (2.90%). Tesla (2.83%). Zoetis (2.69%) ... 
Firsthand Technology Value Fund Inc. (NASDAQ: SVVC) offers a ...",Chris Lange,https://247wallst.com/investing/2020/01/03/minimizing-ipo-investing-risks-in-2020-the-etfs-to-own/,247wallst.com,1578096000,2020-01-04T00:00:00Z,0.08
692909,BMY,Are You Looking for a Top Momentum Pick? Why Bristol-Myers Squibb (BMY) is a Great Choice,"Does Bristol-Myers Squibb (BMY) have what it takes to be a top stock pick for momentum investors? Let's find out.",Zacks Equity Research,https://finance.yahoo.com/news/looking-top-momentum-pick-why-170005002.html,Yahoo.com,,2020-01-03T17:00:05Z,0.79
692827,ABBV,Is AbbVie (ABBV) Stock Outpacing Its Medical Peers This Year?,Is (ABBV) Outperforming Other Medical Stocks This Year?,Zacks Equity Research,https://finance.yahoo.com/news/abbvie-abbv-stock-outpacing-medical-163004537.html,Yahoo.com,,2020-01-03T16:30:04Z,0
693044,JNJ,4 Reasons Why You Should Invest in J&J (JNJ) Stock in 2020,"Here are four reasons which investors may consider while investing in J&J's (JNJ) stock.",Zacks Equity Research,https://finance.yahoo.com/news/4-reasons-why-invest-j-141602795.html,Yahoo.com,,2020-01-03T14:16:02Z,0
692829,ABBV,AbbVie to Present at the 38th Annual J.P. Morgan Healthcare Conference,"AbbVie (NYSE: ABBV), a research-based global biopharmaceutical company, will participate in the 38th Annual J.P. Morgan Healthcare Conference on Wednesday, January 15, 2020. Richard A. Gonzalez, chairman and chief executive officer, will present at 9:30 a.m. …",PR Newswire,https://news.yahoo.com/abbvie-present-38th-annual-j-130000203.html,Yahoo.com,,2020-01-03T13:00:00Z,0
692221,LLY,Lilly to Participate in J.P. Morgan Healthcare Conference,"INDIANAPOLIS, Jan. 2, 2020 /PRNewswire/ -- Eli Lilly and Company (NYSE: LLY) will participate in the 38th Annual J.P. Morgan Healthcare Conference on Tuesday, January 14, 2020. David A. Ricks, Lilly's chairman and chief executive officer, will participate in …",,https://prnmedia.prnewswire.com:443/news-releases/lilly-to-participate-in-jp-morgan-healthcare-conference-300980677.html,Prnewswire.com,,2020-01-02T21:30:00Z,0
691641,MRK,How Much Revenue Does Merck Generate From The United States?,"Merck (NYSE: MRK) generates its revenue primarily from sales of pharmaceutical products. The company generated $18 billion in sales in the United States, accounting for over 40% of its total revenue in 2018. This figure has been on a decline and it dropped fr…","Trefis Team, Contributor, Trefis Team, Contributor https://www.forbes.com/sites/greatspeculations/people/trefis/",https://www.forbes.com/sites/greatspeculations/2020/01/02/how-much-revenue-does-merck-generate-from-the-united-states/,Forbes.com,,2020-01-02T17:00:00Z,0.68
692087,ZTS,Zoetis to Host Webcast and Conference Call on Fourth Quarter and Full Year 2019 Financial Results,"PARSIPPANY, N.J.--(BUSINESS WIRE)---- $ZTS #animalhealth--Zoetis to report Q4 and full year 2019 financial results on Thursday, Feb. 13.",,https://www.businesswire.com/news/home/20200102005085/en/Zoetis-Host-Webcast-Conference-Call-Fourth-Quarter,Businesswire.com,,2020-01-02T13:42:43Z,0
691461,BMY,"Worldwide Insulin Markets, 2015-2018 & 2019-2025 - Key Players are Sanofi, Takeda, Novo Nordisk, Bristol-Myers Squibb, Novartis, Eli Lilly, Oramed, Dongbao Enterprise Group, and Biocon","DUBLIN, Jan. 2, 2020 /PRNewswire/ -- The ""Insulin Market: Global Industry Perspective, Comprehensive Analysis and Forecast, 2018-2025"" report has been added to ResearchAndMarkets.com's offering. The global demand for insulin market was valued at approximately…",,https://www.prnewswire.com/news-releases/worldwide-insulin-markets-2015-2018--2019-2025---key-players-are-sanofi-takeda-novo-nordisk-bristol-myers-squibb-novartis-eli-lilly-oramed-dongbao-enterprise-group-and-biocon-300980402.html,Prnewswire.com,,2020-01-02T13:00:00Z,0.53
691626,LLY,"Worldwide Insulin Markets, 2015-2018 & 2019-2025 - Key Players are Sanofi, Takeda, Novo Nordisk, Bristol-Myers Squibb, Novartis, Eli Lilly, Oramed, Dongbao Enterprise Group, and Biocon","DUBLIN, Jan. 2, 2020 /PRNewswire/ -- The ""Insulin Market: Global Industry Perspective, Comprehensive Analysis and Forecast, 2018-2025"" report has been added to ResearchAndMarkets.com's offering. The global demand for insulin market was valued at approximately…",,https://www.prnewswire.com/news-releases/worldwide-insulin-markets-2015-2018--2019-2025---key-players-are-sanofi-takeda-novo-nordisk-bristol-myers-squibb-novartis-eli-lilly-oramed-dongbao-enterprise-group-and-biocon-300980402.html,Prnewswire.com,,2020-01-02T13:00:00Z,0.53
691462,BMY,Bristol-Myers Squibb to Take Part at the Goldman Sachs 12th Annual Healthcare CEOs Unscripted Conference,NEW YORK--(BUSINESS WIRE)---- $BMY #BMS--Bristol-Myers Squibb to Take Part at the Goldman Sachs 12th Annual Healthcare CEOs Unscripted Conference,,https://www.businesswire.com/news/home/20200102005111/en/Bristol-Myers-Squibb-Part-Goldman-Sachs-12th-Annual,Businesswire.com,,2020-01-02T12:11:02Z,0
691162,JNJ,Johnson & Johnson Announces Quarterly Dividend for First Quarter 2020,"NEW BRUNSWICK, N.J., Jan. 2, 2020 /PRNewswire/ -- Johnson & Johnson (NYSE: JNJ) today announced that its Board of Directors has declared a cash dividend for the first quarter of 2020 of $0.95 per share on the company's common stock. The dividend is payable on…",,https://www.prnewswire.com/news-releases/johnson--johnson-announces-quarterly-dividend-for-first-quarter-2020-300980357.html,Prnewswire.com,,2020-01-02T11:45:00Z,0.3
691129,BMY,Drugmakers hike U.S. prices as 2020 begins,"The drug price hike of 2020 has commenced, with costs rising for more than 250 medicines, according to data analyzed by 3 Axis Advisors.Bristol-Myers Squibb (NYSE:BMY), Gilead Sciences (NASDAQ:GILD),",SA Editor Yoel Minkoff,https://seekingalpha.com/news/3529032-drugmakers-hike-u-s-prices-2020-begins,Seekingalpha.com,,2020-01-02T08:57:30Z,0
690780,ABBV,Why the Earnings Surprise Streak Could Continue for AbbVie (ABBV),AbbVie (ABBV) has an impressive earnings surprise history and currently possesses the right combination of the two key ingredients for a likely beat in its next quarterly report.,Zacks Equity Research,https://finance.yahoo.com/news/why-earnings-surprise-streak-could-171005811.html,Yahoo.com,,2020-01-01T17:10:05Z,0.76
690782,ABBV,Are Investors Undervaluing AbbVie (ABBV) Right Now?,"Here at Zacks, our focus is on the proven Zacks Rank system, which emphasizes earnings estimates and estimate revisions to find great stocks. Nevertheless, we are always paying attention to the latest value, growth, and momentum trends to underscore strong pi…",Zacks Equity Research,https://finance.yahoo.com/news/investors-undervaluing-abbvie-abbv-now-165004285.html,Yahoo.com,,2020-01-01T16:50:04Z,0.91
690804,BMY,More drugmakers hike US prices as new year begins,"NEW YORK: Drug manufacturers including Bristol-Myers Squibb Co, Gilead Sciences Inc, and Biogen Inc hiked US list prices on more than 50 drugs on Wednesday (Jan 1), bringing total New Year's Day drug price increases to more than 250, according to data analyse…",CNA,https://www.channelnewsasia.com/news/business/more-drugmakers-hike-us-prices-as-new-year-begins-12225812,Channelnewsasia.com,,2020-01-01T16:25:39Z,0
690783,ABBV,"Is AbbVie's Stock a Buy?",The stock is trading near its 52-week high even though its returns are flat this year.,newsfeedback@fool.com (David Jagielski),https://www.fool.com/investing/2020/01/01/is-abbvies-stock-a-buy.aspx,Fool.com,,2020-01-01T13:00:00Z,0
690438,ABBV,Company news: Alkem Laboratories,"Alkem Laboratories has entered into an agreement with AbbVie Inc, US, for acquisition of certain assets related to API Dronabinol for $10 million, plus working capital, on closing of the deal. The ass",The Hindu BusinessLine,https://www.thehindubusinessline.com/markets/stock-markets/alkem-laboratories/article30445447.ece,Thehindubusinessline.com,,2020-01-01T03:54:00Z,0.36
