field_name_1,ticker,title,description,author,url,source,timestamp,published_at,sentiment
755854,ABBV,"With Solid Fourth Quarter Results, AbbVie Shows That Its Growth Days Are Far From Over","Despite Humira's declining international sales, AbbVie is still worth considering.",newsfeedback@fool.com (Prosper Junior Bakiny),https://www.fool.com/investing/2020/02/11/with-solid-fourth-quarter-results-abbvie-shows-tha.aspx,Fool.com,,2020-02-11T15:41:34Z,0.62
755855,ABBV,AbbVie to Present at the SVB Leerink 9th Annual Global Healthcare Conference,"AbbVie (NYSE: ABBV), a research-based global biopharmaceutical company, will participate in the SVB Leerink 9th Annual Global Healthcare Conference on Tuesday, February 25. Michael Severino, M.D., vice chairman and president and Robert A. Michael, executive v…",PR Newswire,https://news.yahoo.com/abbvie-present-svb-leerink-9th-130000313.html,Yahoo.com,,2020-02-11T13:00:00Z,0
755856,ABBV,"The Daily Biotech Pulse: LogicBio Slapped With Clinical Hold, Agile Inks Debt Deal Ahead of Twirla Approval, Gilead Builds Stake In Sierra Oncology","Here's a roundup of top developments in the biotech space over the last 24 hours. Scaling The Peaks (Biotech Stocks Hitting 52-week highs on Feb. 10) AbbVie Inc (NYSE: ABBV ) Allergan plc (NYSE: AGN ) ...",,https://finance.yahoo.com/news/daily-biotech-pulse-logicbio-slapped-122306131.html,Yahoo.com,,2020-02-11T12:23:06Z,0.34
756177,LLY,"Lilly's Taltz OK'd in Canada for arthritis of the spine","<ul><li>Health Canada has <a href=""https://seekingalpha.com/pr/17774824-health-canada-approved-taltz-ixekizumab-for-treatment-of-active-ankylosing-spondylitis"" target=""_blank"">approved </a>Eli Lilly's (NYSE:<a href='https://seekingalpha.com/symbol/LLY' title=…",Douglas W. House,https://seekingalpha.com/news/3540423-lillys-taltz-okd-in-canada-for-arthritis-of-spine,Seekingalpha.com,,2020-02-11T12:19:34Z,0
755544,LLY,BRIEF-Health Canada Has Approved Taltz For The Treatment Of Active Ankylosing Spondylitis,Eli Lilly and Co:,Reuters Editorial,https://uk.reuters.com/article/brief-health-canada-has-approved-taltz-f-idUKFWN2AB0FF,Reuters,,2020-02-11T11:54:25Z,0.67
753668,ABBV,"How Allergan Beat Estimates in What's Likely Its Last Quarterly Update",The drugmaker delivered solid top- and bottom-line improvement as it awaited the closing of its acquisition by AbbVie.,newsfeedback@fool.com (Keith Speights),https://www.fool.com/investing/2020/02/10/how-allergan-beat-estimates-in-whats-likely-its-la.aspx,Fool.com,,2020-02-10T18:00:00Z,0.65
753669,ABBV,Allergan Reports Fourth-Quarter 2019 Results That Plow Past Expectations,The maker of Botox appears to be on an upswing just ahead of its megamerger with AbbVie.,newsfeedback@fool.com (Cory Renauer),https://www.fool.com/investing/2020/02/10/allergan-reports-fourth-quarter-2019-results-that.aspx,Fool.com,,2020-02-10T17:24:00Z,0
753814,BMY,Bristol-Myers Squibb Stock Is Too Cheap to Ignore,The acquisition of Celgene is working wonders so far.,newsfeedback@fool.com (Prosper Junior Bakiny),https://www.fool.com/investing/2020/02/10/bristol-myers-squibb-stock-is-too-cheap-to-ignore.aspx,Fool.com,,2020-02-10T17:17:25Z,0
754060,LLY,"Eli Lilly, Roche Drugs Fail to Move Needle in Genetically-Driven Alzheimer’s","<p>Two experimental drugs from Eli Lilly and Roche have failed a clinical trial testing them as treatments for a form of Alzheimer’s disease caused by certain genetic mutations, the companies reported Monday. The study, sponsored by Washington University, tes…",Frank Vinluan,https://xconomy.com/national/2020/02/10/eli-lilly-roche-drugs-fail-to-move-needle-in-genetically-driven-alzheimers/,Xconomy.com,,2020-02-10T15:14:26Z,-0.69
754061,LLY,"Roche, Lilly drugs fail to halt gene-driven Alzheimer's disease","Experimental drugs from Roche and Eli Lilly failed to halt Alzheimer's disease in their latest test, the companies said on Monday, in a blow to people whose genes make them particularly vulnerable to the illness.",John Miller,https://in.reuters.com/article/roche-alzheimers-idINKBN2041G3,Reuters,,2020-02-10T14:55:23Z,-0.89
754062,LLY,"Thinking about buying stock in L Brands, Eli Lilly, Netflix, Tesla, or Xylem?","NEW YORK, Feb. 10, 2020 InvestorsObserver issues critical PriceWatch Alerts for LB, LLY, NFLX, TSLA, and XYL. To see how InvestorsObserver's proprietary scoring system rates these stocks, view the InvestorsObserver's PriceWatch Alert by selecting the correspo…",,https://www.prnewswire.com/news-releases/thinking-about-buying-stock-in-l-brands-eli-lilly-netflix-tesla-or-xylem-301001898.html,Prnewswire.com,,2020-02-10T14:31:00Z,-0.03
753670,ABBV,"Top Analyst Upgrades and Downgrades: AbbVie, Apple, Arch Coal, FedEx, Ford, GM, Nvidia, Skyworks, Stitch Fix, WWE and More","Monday's top analyst upgrades, downgrades and initiations included AbbVie, Apple, Arch Coal, FedEx, Ford, General Motors, Nvidia, Skyworks Solutions, Stitch Fix and World Wrestling Entertainment.",Jon C. Ogg,https://247wallst.com/investing/2020/02/10/top-analyst-upgrades-and-downgrades-abbvie-apple-arch-coal-fedex-ford-gm-nvidia-skyworks-stitch-fix-wwe-and-more/,247wallst.com,,2020-02-10T14:00:31Z,0.73
754258,PRGO,Perrigo: Hold Until Certainty Returns,"With reported sales expanding in 2019, after back-to-back declines, Perrigo is rallying this year.However, the outlook remains uncertain amid the ongoing tax disputes and stagnant organic sales growth.The consumer-focused transformation looks unclear with no …",Dulan Lokuwithana,https://seekingalpha.com/article/4322763-perrigo-hold-until-certainty-returns,Seekingalpha.com,,2020-02-10T13:59:17Z,-0.67
754719,ZTS,Zoetis to Participate in the Bank of America Merrill Lynch Animal Health Summit,"PARSIPPANY, N.J.--(BUSINESS WIRE)---- $ZTS #animalhealth--Zoetis Inc. will present at the Bank of America Merrill Lynch Animal Health Summit on Feb 24th.",,https://www.businesswire.com/news/home/20200210005108/en/Zoetis-Participate-Bank-America-Merrill-Lynch-Animal,Businesswire.com,,2020-02-10T13:38:30Z,0
754064,LLY,"Lilly's stock falls on failed Alzheimer's study","Shares of Eli Lilly and Co. fell 4% in premarket trading on Monday after solanezumab, the experimental therapy it was testing in people with a form of Alzheimer's disease caused by a rare gene mutation, failed in a Phase 2/3 clinical study. Lilly said it does…",Jaimy Lee,https://www.marketwatch.com/story/lillys-stock-falls-on-failed-alzheimers-study-2020-02-10,Marketwatch.com,,2020-02-10T13:01:08Z,-0.77
754065,LLY,"Stocks making the biggest moves in the premarket: Allergan, Taubman Centers, Eli Lilly & more","The stocks making the biggest moves in premarket trading include Allergan, Taubman Centers, Eli Lilly, and more.",Peter Schacknow,https://www.cnbc.com/2020/02/10/stocks-making-the-biggest-moves-in-the-premarket-allergan-taubman-centers-eli-lilly-more.html,CNBC,,2020-02-10T12:46:59Z,0
753370,LLY,Lilly and Roche’s antibodies fail late-phase Alzheimer’s test,"Anti-amyloid beta antibodies in development at Eli Lilly and Roche have failed to improve outcomes in a phase 2/3 Alzheimer’s disease trial. Despite the setback, Roche is continuing two phase 3 trials of its asset in a broader population of Alzheimer’s patien…",Nick Paul,https://www.fiercebiotech.com/biotech/lilly-and-roche-s-antibodies-fail-late-phase-alzheimer-s-test,Fiercebiotech.com,,2020-02-10T11:53:09Z,-0.34
753371,LLY,"Lilly's solanezumab flunks latest Alzheimer's study; shares down 4% premarket","<ul><li>Eli Lilly (NYSE:<a href='https://seekingalpha.com/symbol/LLY' title='Eli Lilly and Company'>LLY</a>) slips <font color=""red"">4%</font> premarket on light volume in reaction to its <a href=""https://seekingalpha.com/pr/17773268-lilly-announces-topline-r…",Douglas W. House,https://seekingalpha.com/news/3539933-lillys-solanezumab-flunks-latest-alzheimers-study-shares-down-4-premarket,Seekingalpha.com,,2020-02-10T11:36:38Z,-0.15
753373,LLY,Eli Lilly AI automates adverse reaction reporting,"Assembling information about adverse reactions to drugs vexes pharmaceutical companies, which are required to produce reports on any incidents to federal regulators. The far-flung data arrives in different languages and formats, making it hard to manage. To r…","Clint Boulton, Clint Boulton",https://www.cio.com/article/3521010/eli-lilly-ai-automates-adverse-reaction-reporting.html,Cio.com,,2020-02-10T11:00:00Z,-0.66
753288,BMY,"Bristol-Myers Squibb Company Annual Results Just Came Out: Here's What Analysts Are Forecasting For Next Year","It's been a good week for Bristol-Myers Squibb Company (NYSE:BMY) shareholders, because the company has just released...",Simply Wall St,https://finance.yahoo.com/news/bristol-myers-squibb-company-annual-104154475.html,Yahoo.com,,2020-02-10T10:41:54Z,0.44
753374,LLY,Lilly Announces Topline Results for Solanezumab from the Dominantly Inherited Alzheimer Network Trials Unit (DIAN-TU) Study,"INDIANAPOLIS, Feb. 10, 2020 /PRNewswire/ -- Eli Lilly and Company (NYSE: LLY) today announced that the analysis performed by Washington University School of Medicine in the Dominantly Inherited Alzheimer Network Trials Unit (DIAN-TU) Study showed that solanez…",,https://prnmedia.prnewswire.com:443/news-releases/lilly-announces-topline-results-for-solanezumab-from-the-dominantly-inherited-alzheimer-network-trials-unit-dian-tu-study-301001653.html,Prnewswire.com,,2020-02-10T06:00:00Z,0.1
752892,MRK,"Merck & Co., Inc. Just Reported Annual Earnings: Have Analysts Changed Their Mind On The Stock?","The yearly results for Merck & Co., Inc. (NYSE:MRK) were released last week, making it a good time to revisit its...",Simply Wall St,https://finance.yahoo.com/news/merck-co-inc-just-reported-143844033.html,Yahoo.com,,2020-02-09T14:38:44Z,0.44
752885,LLY,"Eli Lilly and Company (NYSE:LLY)'s Could Be A Buy For Its Upcoming Dividend","Regular readers will know that we love our dividends at Simply Wall St, which is why it's exciting to see Eli Lilly...",Simply Wall St,https://finance.yahoo.com/news/eli-lilly-company-nyse-lly-130024164.html,Yahoo.com,,2020-02-09T13:00:24Z,0.81
752352,ZTS,"Zoetis Acquires Ethos Diagnostic Science, a Veterinary Reference Lab Business, to Further Expand its Comprehensive Diagnostics Capabilities","PARSIPPANY, N.J. & WOBURN, Mass.--(BUSINESS WIRE)---- $ZTS #acquistion--Zoetis acquires Ethos Diagnostic Science, a veterinary reference lab business, to further expand its comprehensive diagnostics capabilities.",,https://www.businesswire.com/news/home/20200207005449/en/Zoetis-Acquires-Ethos-Diagnostic-Science-Veterinary-Reference,Businesswire.com,,2020-02-07T21:52:15Z,0.77
751910,ABBV,"Uber, AbbVie rise; Wynn, Myrian Genetics fall on Wall Street","NEW YORK (AP) — Stocks that moved heavily or traded substantially on Friday: Uber Technologies Inc., up $3.54 to $40.63 The ride-hailing company reported a big jump in revenue and says it expects to reach profitability earlier than forecast. Ford Motor Co., d…",The Associated Press,https://www.seattletimes.com/business/uber-abbvie-rise-wynn-myrian-genetics-fall-on-wall-street/,Seattletimes.com,,2020-02-07T21:16:46Z,0.3
751912,ABBV,AbbVie Inc (ABBV) Q4 2019 Earnings Call Transcript,"ABBV earnings call for the period ending December 31, 2019.",newsfeedback@fool.com (Motley Fool Transcribers),https://www.fool.com/earnings/call-transcripts/2020/02/07/abbvie-inc-abbv-q4-2019-earnings-call-transcript.aspx,Fool.com,,2020-02-07T20:31:08Z,0
751180,BMY,"Sell-siders on board with Bristol-Myers Squibb's Q4 & outlook","<ul><li>Takeaways from Bristol-Myers Squibb's (<a href='https://seekingalpha.com/symbol/BMY' title='Bristol-Myers Squibb Company'>BMY</a> <font color=""red"">-1.5%</font>) <a href=""https://seekingalpha.com/news/3539183-bristol-myersplus-3-premarket-on-q4-beat"" …",Douglas W. House,https://seekingalpha.com/news/3539775-sell-siders-on-board-bristol-myers-squibbs-q4-outlook,Seekingalpha.com,,2020-02-07T17:50:31Z,0
751347,JNJ,Johnson & Johnson Hit with $750M Punitive Damages Verdict for Failing to Warn about Cancer-Causing Asbestos in Talc Products,"NEW BRUNSWICK, N.J., Feb. 7, 2020 /PRNewswire/ -- A New Jersey jury has ordered Johnson & Johnson (NYSE:JNJ) to pay $750 million in punitive damages to four cancer victims who charged that the company's iconic Johnson's Baby Powder contained cancer-causing as…",,https://prnmedia.prnewswire.com:443/news-releases/johnson--johnson-hit-with-750m-punitive-damages-verdict-for-failing-to-warn-about-cancer-causing-asbestos-in-talc-products-301001036.html,Prnewswire.com,,2020-02-07T17:34:00Z,-0.97
751082,ABBV,"AbbVie Stock: AbbVie Earnings Top, Guidance Solid - Investor's Business Daily","AbbVie stock flirted with a breakout Friday after the pharma giant topped Wall Street's fourth-quarter earnings expectations and delivered in-line sales.","Investor's Business Daily",https://www.investors.com/news/technology/abbvie-stock-abbvie-earnings-q4-2019/,Investors.com,,2020-02-07T16:02:00Z,0.3
751083,ABBV,AbbVie Wows Again With Q4 Results,AbbVie released better than expected fourth-quarter financial results before the markets opened on Friday.,247chrislange,https://247wallst.com/healthcare-business/2020/02/07/abbvie-wows-again-with-q4-results/,247wallst.com,,2020-02-07T15:20:09Z,0.71
751084,ABBV,"Thinking about trading options or stock in AbbVie, Gilead Sciences, Microsoft, NVIDIA, or Shopify?","NEW YORK, Feb. 7, 2020 /PRNewswire/ -- InvestorsObserver issues critical PriceWatch Alerts for ABBV, GILD, MSFT, NVDA, and SHOP. Click a link below then choose between in-depth options trade idea report or a stock score report. Options Report – Ideal trade id…",,https://www.prnewswire.com/news-releases/thinking-about-trading-options-or-stock-in-abbvie-gilead-sciences-microsoft-nvidia-or-shopify-301000944.html,Prnewswire.com,,2020-02-07T14:31:00Z,0.27
751085,ABBV,AbbVie +4% premarket on Q4 and guidance beat,"<ul><li>AbbVie (<a href='https://seekingalpha.com/symbol/ABBV' title='AbbVie Inc.'>ABBV</a>) <a href=""https://seekingalpha.com/pr/17772660-abbvie-reports-full-year-and-fourth-quarter-2019-financial-results"" target=""_blank"">Q4 results</a>:</li><li>Revenues: $8…",Mamta Mayani,https://seekingalpha.com/news/3539677-abbvieplus-4-premarket-on-q4-and-guidance-beat,Seekingalpha.com,,2020-02-07T13:40:17Z,0
751086,ABBV,"AbbVie's stock rises on strong earnings","Shares of AbbVie Inc. climbed 2% in premarket trading on Friday although the drugmaker beat earnings expectations for the quarter. The company reported earnings of $2.8 billion, or $1.88 per share, in the fourth quarter of 2019, compared with a loss of $1.8 b…",Jaimy Lee,https://www.marketwatch.com/story/abbvies-stock-rises-on-strong-earnings-2020-02-07,Marketwatch.com,,2020-02-07T13:10:43Z,0.49
751540,PRGO,Perrigo Announces Consumer Self-Care Americas Segment Leadership Transition,"Perrigo Company plc (NYSE: PRGO; TASE), a leading global provider of Quality, Affordable Self-Care Products™, today announced the future retirement of Jeff Needham, Executive Vice President and President, Consumer Self-Care Americas (CSCA). Rich Sorota, curre…",PR Newswire,https://news.yahoo.com/perrigo-announces-consumer-self-care-131000444.html,Yahoo.com,,2020-02-07T13:10:00Z,0.56
751087,ABBV,AbbVie: 4Q Earnings Snapshot,"NORTH CHICAGO, Ill. (AP) — AbbVie Inc. (ABBV) on Friday reported fourth-quarter earnings of $2.8 billion.",,https://www.stltoday.com/business/national-and-international/abbvie-q-earnings-snapshot/article_bb97c8c5-358e-5a25-87bc-145637247215.html,Stltoday.com,,2020-02-07T12:54:12Z,-0.82
751088,ABBV,AbbVie leans on new treatments to forecast upbeat 2020 profit,AbbVie Inc  on Friday forecast 2020 earnings above Wall Street estimates as the drugmaker expects growth to be powered by its new treatments for psoriasis and rheumatoid arthritis at a time when sales of its blockbuster drug Humira slow.,CNA,https://www.channelnewsasia.com/news/business/abbvie-leans-on-new-treatments-to-forecast-upbeat-2020-profit-12406766,Channelnewsasia.com,,2020-02-07T12:50:32Z,0.76
751089,ABBV,"AbbVie EPS beats by $0.02, beats on revenue","<ul><li>AbbVie (NYSE:<a href='https://seekingalpha.com/symbol/ABBV' title='AbbVie Inc.'>ABBV</a>): Q4 Non-GAAP EPS of $2.21 <font color=""green"">beats by $0.02</font>; GAAP EPS of $1.88 <font color=""green"">beats by $0.05</font>.</li><li>Revenue of $8.7B (+4.7%…",Mamta Mayani,https://seekingalpha.com/news/3539653-abbvie-eps-beats-0_02-beats-on-revenue,Seekingalpha.com,,2020-02-07T12:46:50Z,0
751090,ABBV,AbbVie Reports Full-Year and Fourth-Quarter 2019 Financial Results,"NORTH CHICAGO, Ill., Feb. 7, 2020 /PRNewswire/ -- AbbVie (NYSE:ABBV) announced financial results for the fourth quarter and full year ended December 31, 2019. ""Our strong performance this quarter completes another excellent year for AbbVie,"" said Richard A. G…",,https://www.prnewswire.com/news-releases/abbvie-reports-full-year-and-fourth-quarter-2019-financial-results-301000918.html,Prnewswire.com,,2020-02-07T12:43:00Z,0.79
750676,ZTS,Responsible use of moxidectin in sheep,"SCOPS (sustainable control of parasites in sheep) and Zoetis held a joint workshop in September 2019 to discuss how to advise prescribers and sheep farmers on the use of moxidectin, and prioritising the 2 per cent injectable formulation. This was in response …","Hart, N.",https://veterinaryrecord.bmj.com/content/186/5/161.1,Bmj.com,,2020-02-07T00:05:30Z,0.32
749982,BMY,Bristol-Myers Squibb Smashes Earnings Predictions Following Celgene Acquisition,2019 marked a pivotal turning point for the pharmaceutical giant Continue reading...,GuruFocus.com,https://finance.yahoo.com/news/bristol-myers-squibb-smashes-earnings-212823920.html,Yahoo.com,,2020-02-06T21:28:23Z,0
748867,BMY,Bristol-Myers Squibb and Merck going opposite ways with PD-1 inhibitors,"<ul><li>Q4 results for Merck (<a href='https://seekingalpha.com/symbol/MRK' title='Merck & Co., Inc.'>MRK</a> <font color=""red"">-0.3%</font>) and Bristol-Myers Squibb (<a href='https://seekingalpha.com/symbol/BMY' title='Bristol-Myers Squibb Company'>BMY</a> …",Douglas W. House,https://seekingalpha.com/news/3539335-bristol-myers-squibb-and-merck-going-opposite-ways-pdminus-1-inhibitors,Seekingalpha.com,,2020-02-06T18:06:01Z,0
748868,BMY,Bristol-Myers Squibb Company (BMY) CEO Giovanni Caforio on Q4 2019 Results - Earnings Call Transcript,,SA Transcripts,https://seekingalpha.com/article/4322044-bristol-myers-squibb-company-bmy-ceo-giovanni-caforio-on-q4-2019-results-earnings-call,Seekingalpha.com,,2020-02-06T17:44:34Z,0
748869,BMY,"Bristol-Myers Squibb's Earnings Get a Boost From Celgene Acquisition","The pharmaceutical giant's guidance also looks good.",newsfeedback@fool.com (Brian Orelli),https://www.fool.com/investing/2020/02/06/bristol-myers-squibbs-earnings-get-a-boost-from-ce.aspx,Fool.com,,2020-02-06T17:08:00Z,0.68
748870,BMY,Bristol-Myers Squibb Company 2019 Q4 - Results - Earnings Call Presentation,,SA Transcripts,https://seekingalpha.com/article/4322009-bristol-myers-squibb-company-2019-q4-results-earnings-call-presentation,Seekingalpha.com,,2020-02-06T16:49:20Z,0
749076,LLY,"Thinking about trading options or stock in Apple, Eli Lilly, Microchip Technology, Tesla, or UnitedHealth Group?","NEW YORK, Feb. 6, 2020 /PRNewswire/ -- InvestorsObserver issues critical PriceWatch Alerts for AAPL, LLY, MCHP, TSLA, and UNH. Click a link below then choose between in-depth options trade idea report or a stock score report. Options Report – Ideal trade idea…",,https://prnmedia.prnewswire.com:443/news-releases/thinking-about-trading-options-or-stock-in-apple-eli-lilly-microchip-technology-tesla-or-unitedhealth-group-301000320.html,Prnewswire.com,,2020-02-06T14:31:00Z,0.27
748761,ABBV,"Top Analyst Upgrades and Downgrades: AbbVie, Biogen, Boeing, Etsy, Gilead, GoPro, Micron, Newmont, Peloton, Pfizer, Valero, Zynga and More","Thursday's top analyst upgrades, downgrades and initiations included AbbVie, Biogen, Boeing, Etsy, Gilead Sciences, GoPro, Micron Technology, Newmont, Peloton Interactive, Pfizer, Valero Energy and Zynga.",Jon C. Ogg,https://247wallst.com/investing/2020/02/06/top-analyst-upgrades-and-downgrades-abbvie-biogen-boeing-etsy-gilead-gopro-micron-newmont-peloton-pfizer-valero-zynga-and-more/,247wallst.com,,2020-02-06T13:45:23Z,0.57
748871,BMY,Bristol-Myers +3% premarket on Q4 beat,"<ul><li>Bristol-Myers Squibb (<a href='https://seekingalpha.com/symbol/BMY' title='Bristol-Myers Squibb Company'>BMY</a>) Q4 results: Revenues: $7,945M (+33.0%); R&D Expense: $7,662M (+34.1%).</li><li>Net loss: ($1,056M); loss/share: ($0.55); non-GAAP Net Inc…",Mamta Mayani,https://seekingalpha.com/news/3539183-bristol-myersplus-3-premarket-on-q4-beat,Seekingalpha.com,,2020-02-06T13:13:55Z,-0.32
748872,BMY,"Bristol-Myers Squibb reports 33% jump in Q4 revenue, Opdivo sales fall 2%","Shares of Bristol-Myers Squibb were up 2% in premarket trading on Thursday after the company beat earnings estimates for the fourth quarter of 2019. The company had a net loss of $1.1 billion, or 44 cents per share, in the fourth quarter of 2019, after earnin…",Jaimy Lee,https://www.marketwatch.com/story/bristol-myers-squibb-reports-33-jump-in-q4-revenue-opdivo-sales-fall-2-2020-02-06,Marketwatch.com,,2020-02-06T12:49:46Z,-0.03
748762,ABBV,Mizuho likes AbbVie in premarket analyst action,"<ul><li>AbbVie (NYSE:<a href='https://seekingalpha.com/symbol/ABBV' title='AbbVie Inc.'>ABBV</a>) initiated with Buy rating and $96 (11% upside) price target at Mizuho Securities. Shares up a fraction premarket.</li><li>Alkermes plc (NASDAQ:<a href='https://s…",Douglas W. House,https://seekingalpha.com/news/3539113-mizuho-likes-abbvie-in-premarket-analyst-action,Seekingalpha.com,,2020-02-06T12:19:24Z,0.74
748873,BMY,Bristol-Myers Squibb Reports Fourth Quarter and Full Year Financial Results for 2019,NEW YORK--(BUSINESS WIRE)---- $BMY--Bristol-Myers Squibb Reports Fourth Quarter and Full Year Financial Results for 2019,,https://www.businesswire.com/news/home/20200206005479/en/Bristol-Myers-Squibb-Reports-Fourth-Quarter-Full-Year,Businesswire.com,,2020-02-06T12:10:12Z,0
748874,BMY,"Bristol-Myers Squibb EPS beats by $0.28, beats on revenue","<ul><li>Bristol-Myers Squibb (NYSE:<a href='https://seekingalpha.com/symbol/BMY' title='Bristol-Myers Squibb Company'>BMY</a>): Q4 Non-GAAP EPS of $1.22 <font color=""green"">beats by $0.28</font>; GAAP EPS of -$0.55 <font color=""red"">misses by $1.39</font>.</l…",Mamta Mayani,https://seekingalpha.com/news/3539094-bristol-myers-squibb-eps-beats-0_28-beats-on-revenue,Seekingalpha.com,,2020-02-06T12:08:25Z,0
748875,BMY,Bristol-Myers earnings rise due to Celgene deal,"Bristol-Myers Squibb Co said on Thursday its operating profit rose by around a third from a year ago because fourth-quarter results included some revenue from Celgene, which the U.S. drugmaker bought in a $74 billion deal that closed in late November. Bristol…",,https://finance.yahoo.com/news/bristol-myers-earnings-rise-due-115900546.html,Yahoo.com,,2020-02-06T11:59:00Z,0.44
747578,ABBV,AbbVie Reports Successful Trial Results for Arthritis Drug,A future blockbuster scores another success as AbbVie works to replace Humira losses.,newsfeedback@fool.com (Jim Crumly),https://www.fool.com/investing/2020/02/05/abbvie-reports-successful-trial-results-for-arthri.aspx,Fool.com,,2020-02-05T21:12:48Z,0.87
746829,MRK,"Merck to streamline business, separate into two companies","Merck & Co. Inc. unveiled plans Wednesday to spin off products from its women’s health and biosimilars businesses, along with certain legacy brands, into a new independent and publicly traded company. Going forward, Merck (NYSE: MRK) will focus on its oncolog…",John George,https://www.bizjournals.com/philadelphia/news/2020/02/05/merck-to-streamline-business-separate-into-two.html?ana=RSS&s=article_search&utm_source=feedburner&utm_medium=feed&utm_campaign=Feed%3A+bizj_philadelphia+%28Philadelphia+Business+Journal%29,Bizjournals.com,,2020-02-05T14:26:55Z,0.27
746506,ABBV,"AbbVie's Rinvoq successful in second late-stage psoriatic arthritis study","<ul><li>AbbVie (NYSE:<a href='https://seekingalpha.com/symbol/ABBV' title='AbbVie Inc.'>ABBV</a>) <a href=""https://seekingalpha.com/pr/17769867-rinvoq-upadacitinib-meets-primary-and-key-secondary-endpoints-in-phase-3-study-in-psoriatic"" target=""_blank"">announ…",Douglas W. House,https://seekingalpha.com/news/3538534-abbvies-rinvoq-successful-in-second-late-stage-psoriatic-arthritis-study,Seekingalpha.com,,2020-02-05T14:12:03Z,0.59
746527,ALLY,Ally Transforms How People Save,"SANDY, Utah, Feb. 5, 2020 /PRNewswire/ -- Ally Bank (Ally), the customer-obsessed banking arm of Ally Financial (NYSE: ALLY), which has grown to be the largest fully digital bank in the U.S., today introduced a collection of smart savings tools to its Online …",,https://www.prnewswire.com/news-releases/ally-transforms-how-people-save-300998972.html,Prnewswire.com,,2020-02-05T14:00:00Z,0.4
746507,ABBV,RINVOQ™ (upadacitinib) Meets Primary and Key Secondary Endpoints in Phase 3 Study in Psoriatic Arthritis,"NORTH CHICAGO, Ill., Feb. 5, 2020 /PRNewswire/ -- AbbVie (NYSE: ABBV), a research-based global biopharmaceutical company, today announced positive top-line results from the Phase 3 SELECT-PsA 1 clinical trial. In this study, both doses of RINVOQTM (upadacitin…",,https://prnmedia.prnewswire.com:443/news-releases/rinvoq-upadacitinib-meets-primary-and-key-secondary-endpoints-in-phase-3-study-in-psoriatic-arthritis-300999462.html,Prnewswire.com,,2020-02-05T13:45:00Z,0.56
