field_name_1,ticker,title,description,author,url,source,timestamp,published_at,sentiment
639720,ABBV,Why AbbVie Might Fall After The Mega-Merger With Allergan,,,https://seekingalpha.com/article/4309295-abbvie-might-fall-mega-merger-allergan?source=feed_all_articles,Seekingalpha.com,,2019-11-26T20:45:09Z,0
638617,ALLY,Are Hedge Funds Right About Ally Financial Inc (ALLY) ?,"How do we determine whether Ally Financial Inc (NYSE:ALLY) makes for a good investment at the moment? We analyze the sentiment of a select group of the very best investors in the world, who spend immense amounts of time and resources studying companies. They …",Abigail Fisher,https://finance.yahoo.com/news/hedge-funds-ally-financial-inc-141407852.html,Yahoo.com,,2019-11-26T14:14:07Z,0.83
638124,BMY,Bristol-Myers Squibb to Hold Investor Webcast to Discuss ASH Highlights,NEW YORK--(BUSINESS WIRE)---- $BMY--Bristol-Myers Squibb to Hold Investor Webcast to Discuss ASH Highlights,,https://www.businesswire.com/news/home/20191126005162/en/Bristol-Myers-Squibb-Hold-Investor-Webcast-Discuss-ASH,Businesswire.com,,2019-11-26T12:05:27Z,0
638063,ZTS,Zoetis (ZTS) Acquires ZNLabs to Bolster Diagnostics Portfolio,Zoetis (ZTS) acquires ZNLabs and expands its reference laboratory capabilities in the United States.,Zacks Equity Research,https://finance.yahoo.com/news/zoetis-zts-acquires-znlabs-bolster-220810477.html,Yahoo.com,,2019-11-25T22:08:10Z,0.49
636663,MRK,"Hedge Funds Are Optimistic About Merck & Co., Inc. (MRK)","We can judge whether Merck & Co., Inc. (NYSE:MRK) is a good investment right now by following the lead of some of the best investors in the world and piggybacking their ideas. There's no better way to get these firms' immense resources and analytical capabili…",,https://finance.yahoo.com/news/hedge-funds-optimistic-merck-co-140143262.html,Yahoo.com,,2019-11-25T14:01:43Z,0.88
636325,ABBV,AbbVie Is The First Addition To The Motorhome Retirement 72T Portfolio,Healthcare via the Affordable Care Act (ACA) has been a part of our early retirement plan.The ACA has been challenged in the federal courts and the supreme court will likely determine its fate.We changed the plan and now use a 72T withdrawal to address the un…,GrayBeard Retirement,https://seekingalpha.com/article/4308909-abbvie-first-addition-motorhome-retirement-72t-portfolio,Seekingalpha.com,,2019-11-25T14:00:00Z,0.76
635850,MRK,New Survey of Young Adults Uncovers Low Levels of Accurate Knowledge About HIV Transmission Coupled with High-Risk Sexual Behaviors,"Merck (NYSE: MRK) known as MSD outside the United States and Canada, in partnership with Prevention Access Campaign today launched Owning HIV: Young Adults and the Fight Ahead, a new campaign featuring results from a first-of-its-kind survey to better underst…",PR Newswire,https://news.yahoo.com/survey-young-adults-uncovers-low-114500639.html,Yahoo.com,,2019-11-25T11:45:00Z,0.36
635089,ABBV,Better Buy: AbbVie vs. GlaxoSmithKline,"AbbVie and GlaxoSmithKline are both poised for a big 2020. Still, one stock is clearly the better buy right now.",newsfeedback@fool.com (George Budwell),https://www.fool.com/investing/2019/11/24/better-buy-abbvie-vs-glaxosmithkline.aspx,Fool.com,,2019-11-24T13:25:00Z,0.86
634975,BMY,"Why I'm Holding On to My Bristol-Myers Squibb Shares Now That the Celgene Acquisition Has Closed","There are two reasons this Fool isn't selling his newfound shares from the Celgene buyout.",newsfeedback@fool.com (Keith Speights),https://www.fool.com/investing/2019/11/24/why-im-holding-onto-my-bristol-myers-squibb-shares.aspx,Fool.com,,2019-11-24T12:00:00Z,0.01
634619,LLY,Better Buy: Johnson & Johnson vs. Eli Lilly,Which stock wins in a head-to-head matchup between these two healthcare giants?,newsfeedback@fool.com (Keith Speights),https://www.fool.com/investing/2019/11/23/better-buy-johnson-johnson-vs-eli-lilly.aspx,Fool.com,,2019-11-23T13:00:00Z,0.77
632879,BMY,"Pharma Stock Roundup: FDA Nod to NVS' & AZN's Drugs, BMY-CELG Merger Closes","The FDA approves Novartis' (NVS) sickle cell disease candidate Adakveo and AstraZeneca's (AZN) Calquence for chronic lymphocytic leukemia. Bristol-Myers (BMY) completes $74 billion-buyout of Celgene.",Kinjel Shah,https://finance.yahoo.com/news/pharma-stock-roundup-fda-nod-155703573.html,Yahoo.com,,2019-11-22T15:57:03Z,0.4
632764,ABBV,AstraZeneca shares rise on early U.S. approval for leukemia drug,"AstraZeneca shares rose 2.7% on Friday after the British drugmaker won earlier-than-expected U.S. regulatory approval for a leukemia drug, in a challenge to rival AbbVie .",Reuters Editorial,https://www.reuters.com/article/us-astrazeneca-approval-idUSKBN1XW1OI,Reuters,,2019-11-22T15:16:59Z,0.93
632765,ABBV,AstraZeneca shares rise on early US approval for leukemia drug,"AstraZeneca shares rose 2.7per cent on Friday after the British drugmaker won earlier-than-expected U.S. regulatory approval for a leukemia drug, in a challenge to rival AbbVie.",CNA,https://www.channelnewsasia.com/news/world/astrazeneca-shares-rise-on-early-us-approval-for-leukemia-drug-12118558,Channelnewsasia.com,,2019-11-22T15:10:48Z,0.93
633068,LLY,Lilly (LLY) Up 6.4% Since Last Earnings Report: Can It Continue?,"Lilly (LLY) reported earnings 30 days ago. What's next for the stock? We take a look at earnings estimates for some clues.",Zacks Equity Research,https://finance.yahoo.com/news/lilly-lly-6-4-since-143102584.html,Yahoo.com,,2019-11-22T14:31:02Z,0
633097,MRK,Merck (MRK) is an Incredible Growth Stock: 3 Reasons Why,"Merck (MRK) possesses solid growth attributes, which could help it handily outperform the market.",Zacks Equity Research,https://finance.yahoo.com/news/merck-mrk-incredible-growth-stock-134501127.html,Yahoo.com,,2019-11-22T13:45:01Z,0.82
633835,ZTS,Zoetis buys network of veterinary reference labs,"Zoetis (NYSE:ZTS) acquires ZNLabs, a full-service veterinary clinical reference laboratory company with a network of labs across the U.S.Zoetis entered reference lab services with its acquisition of P",Liz Kiesche,https://seekingalpha.com/news/3521504-zoetis-buys-network-veterinary-reference-labs,Seekingalpha.com,,2019-11-22T13:09:07Z,0
633836,ZTS,"Zoetis Acquires ZNLabs, a Nationwide Veterinary Reference Laboratory, to Further Strengthen its Comprehensive Diagnostics Portfolio","PARSIPPANY, N.J. & TAMPA, Fla.--(BUSINESS WIRE)---- $ZTS #acquisition--Zoetis expands its reference laboratory capabilities in the U.S. with the acquisition of ZNLabs.",,https://www.businesswire.com/news/home/20191122005045/en/Zoetis-Acquires-ZNLabs-Nationwide-Veterinary-Reference-Laboratory,Businesswire.com,,2019-11-22T13:05:24Z,0.57
632880,BMY,"Bio Roundup: So Long Celgene, RNAi’s Arrival, Pharma in 2020 & More","<p>Bristol-Myers Squibb this week completed its acquisition of Celgene, a $74 billion deal that creates a pharmaceutical juggernaut. And all it took was the largest asset sale ever required by federal antitrust regulators. As the Federal Trade Commission revi…",Frank Vinluan,https://xconomy.com/national/2019/11/22/bio-roundup-so-long-celgene-rnais-arrival-pharma-in-2020-more/,Xconomy.com,,2019-11-22T12:50:36Z,0.56
632209,ABBV,"Enanta Pharmaceuticals' Q4 Results Pulled Down by AbbVie's Sinking HCV Sales","The small drugmaker depends on royalties from HCV drug Mavyret. And those sales aren't as strong as they used to be.",newsfeedback@fool.com (Keith Speights),https://www.fool.com/investing/2019/11/22/enanta-pharmaceuticals-q4-results-pulled-down-by-a.aspx,Fool.com,,2019-11-22T11:00:00Z,-0.4
631797,LLY,"Why Eli Lilly Can't Match Novo Nordisk","Like Novo Nordisk, Eli Lilly is one of the major players in the diabetes market.While the diabetes/endocrinology segment outperformed in the recent past, the overall performance of Eli Lilly was mixed.Compared to Novo Nordisk, the Danish diabetes company seem…",Daniel Schönberger,https://seekingalpha.com/article/4308457-eli-lilly-match-novo-nordisk,Seekingalpha.com,,2019-11-22T03:19:50Z,0
631606,BMY,"Bristol-Myers' Melanoma Study Misses Goal, Closes Celgene Deal","Bristol-Myers' (BMY) late-stage study evaluating the Opdivo-Yervoy combo fails to meet a co-primary endpoint of recurrence-free survival in melanoma patients. The company wraps up Celgene acquisition.",Zacks Equity Research,https://finance.yahoo.com/news/bristol-myers-melanoma-study-misses-225810954.html,Yahoo.com,,2019-11-21T22:58:10Z,-0.57
631891,PRGO,"Taro's tavaborole gets tentative FDA OK","The FDA has granted tentative approval to Taro Pharmaceutical Industries' (NYSE:TARO) tavaborole, the generic active ingredient in Kerydin (by Novartis (NYSE:NVS) and Pfizer (NYSE:PFE)). Perrigo (NYS",Jason Aycock,https://seekingalpha.com/news/3521393-taros-tavaborole-gets-tentative-fda-ok,Seekingalpha.com,,2019-11-21T22:03:24Z,0.78
631521,ABBV,AbbVie Shareholders Have a Lot to Look Forward To With Allergan,The big drugmaker shared a little more color on the potentially transformative acquisition in its third-quarter call.,newsfeedback@fool.com (Michael Afshar),https://www.fool.com/investing/2019/11/21/abbvie-shareholders-have-a-lot-to-look-forward-to.aspx,Fool.com,,2019-11-21T20:24:00Z,0.34
630365,ABBV,"AbbVie to Present Latest Clinical Research in the Treatment of Leukemias, Lymphomas and Other Blood Cancers at 2019 ASH Annual Meeting","NORTH CHICAGO, Ill., Nov. 21, 2019 /PRNewswire/ -- AbbVie (NYSE: ABBV), a research-based global biopharmaceutical company, today announced that more than 40 abstracts, including 18 oral presentations, will be presented during the upcoming American Society of …",,https://www.prnewswire.com/news-releases/abbvie-to-present-latest-clinical-research-in-the-treatment-of-leukemias-lymphomas-and-other-blood-cancers-at-2019-ash-annual-meeting-300962704.html,Prnewswire.com,,2019-11-21T13:30:00Z,0
630366,ABBV,Neurocrine Making The Most Of A Strong Ingrezza Launch,"Ingrezza continues to beat raised expectations, with sales up 10% over the second quarter and a large potential untapped market still out there.
        Orlissa sales continue to disappoint, but AbbVie now seems to be ready to try something new and different …","Stephen Simpson, CFA",https://seekingalpha.com/article/4308228-neurocrine-making-strong-ingrezza-launch,Seekingalpha.com,,2019-11-21T13:09:26Z,0.57
630367,ABBV,"The Top Large-Cap Sectors, Industries, And Stocks To Buy Now","The best-ranked large-cap sector is industrial goods.The top-rated industry is trucking.The strongest-scoring stocks include AbbVie, Eaton Vance, and Carlisle Companies.",Limelight Alpha Management Partners,https://seekingalpha.com/article/4308176-top-large-cap-sectors-industries-stocks-buy-now,Seekingalpha.com,,2019-11-21T13:00:00Z,0.2
629953,BMY,Bristol-Myers Squibb Company Announces Final Results of Exchange Offers for Celgene Corporation Notes,NEW YORK--(BUSINESS WIRE)---- $BMY--Bristol-Myers Squibb Company Announces Final Results of Exchange Offers for Celgene Corporation Notes,,https://www.businesswire.com/news/home/20191121005279/en/Bristol-Myers-Squibb-Company-Announces-Final-Results-Exchange,Businesswire.com,,2019-11-21T12:06:35Z,0
629367,BMY,Bristol-Myers Squibb completes $74 billion acquisition of Celgene,"Bristol-Myers Squibb Co. on Wednesday said it completed its $74 billion acquisition of Celgene Corp., nearly a year after announcing the controversial deal. The completion comes after the Federal Trade Commission cleared the merger in a statement on Friday. T…",Jon Swartz,https://www.marketwatch.com/story/bristol-myers-squibb-completes-74-billion-acquisition-of-celgene-2019-11-20,Marketwatch.com,,2019-11-20T21:36:06Z,-0.1
629369,BMY,Celgene Announces Plans to Transfer Listing of Celgene’s Contingent Value Rights Following Closing of Acquisition by Bristol-Myers Squibb,"SUMMIT, N.J.--(BUSINESS WIRE)--Celgene Corporation (NASDAQ: CELG) announced today that following the completion of Celgene’s acquisition by Bristol-Myers Squibb Company (NYSE: BMY), Bristol-Myers Squibb and Celgene plan to transfer the listing of Celgene’s co…",,https://www.businesswire.com/news/home/20191120005937/en/Celgene-Announces-Plans-Transfer-Listing-Celgene%E2%80%99s-Contingent,Businesswire.com,,2019-11-20T21:24:16Z,0.34
629368,BMY,"Bristol-Myers Squibb Completes Acquisition of Celgene, Creating a Leading Biopharma Company",NEW YORK--(BUSINESS WIRE)--Bristol-Myers Squibb Company (NYSE:BMY) announced today that it has completed its acquisition of Celgene Corporation (NASDAQ:CELG) following the receipt of regulatory approval from all government authorities required by the merger a…,,https://www.businesswire.com/news/home/20191120005929/en/Bristol-Myers-Squibb-Completes-Acquisition-Celgene-Creating-Leading,Businesswire.com,,2019-11-20T21:24:16Z,0.65
628333,BMY,"Zacks.com featured highlights include: Bristol-Myers Squibb, Urban Outfitters, Hewlett Packard, Cardinal Health and British American Tobacco","Zacks.com featured highlights include: Bristol-Myers Squibb, Urban Outfitters, Hewlett Packard, Cardinal Health and British American Tobacco",Zacks Equity Research,https://finance.yahoo.com/news/zacks-com-featured-highlights-bristol-144702708.html,Yahoo.com,,2019-11-20T14:47:02Z,0
628178,ABBV,"California Life Sciences Association (CLSA) Adds Leaders from AbbVie, Merck and Lasana Partners to Board of Directors","SAN FRANCISCO & SAN DIEGO--(BUSINESS WIRE)-- #Abbvie--California Life Sciences Association (CLSA) Adds Leaders from AbbVie, Merck and Lasana Partners to Board of Directors",,https://www.businesswire.com/news/home/20191120005232/en/California-Life-Sciences-Association-CLSA-Adds-Leaders,Businesswire.com,,2019-11-20T14:42:32Z,0
628335,BMY,"Thinking about buying stock in Aurora Cannabis, Advanced Micro Devices, Bristol-Myers Squibb, Nike, or Visa?","NEW YORK, Nov. 20, 2019 /PRNewswire/ -- InvestorsObserver issues critical PriceWatch Alerts for ACB, AMD, BMY, NKE, and V. To see how InvestorsObserver's proprietary scoring system rates these stocks, view the InvestorsObserver's PriceWatch Alert by selecting…",,https://www.prnewswire.com/news-releases/thinking-about-buying-stock-in-aurora-cannabis-advanced-micro-devices-bristol-myers-squibb-nike-or-visa-300962029.html,Prnewswire.com,,2019-11-20T14:31:00Z,0.23
628179,ABBV,"Neurocrine Bounces Back With Authority, But Little Upside Appears Evident As New Year Approaches","When Neurocrine dipped into the $70s in late 2018, it seemed like an obvious buy.Now that Neurocrine is nearing all-time highs again on the heels of Ingrezza, additional upside heading into the new year is difficult to find.Orilissa, with AbbVie as partner, c…",Clover Biotech Research,https://seekingalpha.com/article/4307989-neurocrine-bounces-back-authority-little-upside-appears-evident-new-year-approaches,Seekingalpha.com,,2019-11-20T13:55:11Z,0.08
628544,JNJ,"JNJ Stock Is a Buy Because the Pharma Business Will Grow More - Barron's","JNJ Stock Is a Buy Because the Pharma Business Will Grow More Barron's",Josh Nathan-Kazis,https://www.barrons.com/articles/jnj-stock-pharma-business-51574256960,Barrons.com,,2019-11-20T13:42:00Z,0
628336,BMY,UPDATE 1-Bristol-Myers misses main goal of late-stage skin cancer trial,"Bristol-Myers Squibb Co said on Wednesday a late-stage trial testing a combination of its cancer drugs missed a main goal of preventing skin cancer from recurring in a certain group of patients, sending its shares down nearly 1%. The company said the trial wi…",,https://finance.yahoo.com/news/1-bristol-myers-misses-main-123632906.html,Yahoo.com,,2019-11-20T12:36:32Z,-0.93
628337,BMY,Bristol-Myers misses main goal of late-stage skin cancer trial,Bristol-Myers Squibb Co said on Wednesday its late-stage trial testing a combination of its cancer drugs missed a main goal of preventing skin cancer from recurring in a certain group of patients.,CNA,https://www.channelnewsasia.com/news/world/bristol-myers-misses-main-goal-of-late-stage-skin-cancer-trial-12111546,Channelnewsasia.com,,2019-11-20T12:25:52Z,-0.95
627814,LLY,Eli Lilly to create 100 jobs in Indianapolis as it adds capacity to its technology center campus,Eli Lilly & Co. said Wednesday that it will create 100 new jobs in Indianapolis as it invests $400 million in its manufacturing facilities at its Lilly Technology Center campus. The drug maker said its plans are a result of increased demand for its medicines …,Tomi Kilgore,https://www.marketwatch.com/story/eli-lilly-to-create-100-jobs-in-indianapolis-as-it-adds-capacity-to-its-technology-center-campus-2019-11-20,Marketwatch.com,,2019-11-20T12:09:08Z,0.59
627815,LLY,Lilly to invest $400M in Indianapolis manufacturing facilities,"Aimed at boosting manufacturing capacity for future drugs from its pipeline, Eli Lilly (NYSE:LLY) will invest $400M in its Lilly Technology Center campus in Indianapolis. The action will create ~100 n",SA Editor Douglas W. House,https://seekingalpha.com/news/3520758-lilly-invest-400m-indianapolis-manufacturing-facilities,Seekingalpha.com,,2019-11-20T12:09:02Z,0.54
627738,BMY,Bristol-Myers stock slides premarket after melanoma trial fails to meet main goal,"Bristol-Myers Squibb Co. shares slid 0.9% in premarket trade Wednesday, after the drug company said a trial of opdivo plus yervoy in treating patients who have had surgery to treat melanoma failed to meet its main goal. ""A statistically significant benefit wa…",Ciara Linnane,https://www.marketwatch.com/story/bristol-myers-stock-slides-premarket-after-melanoma-trial-fails-to-meet-main-goal-2019-11-20,Marketwatch.com,,2019-11-20T12:08:36Z,0.38
627739,BMY,Bristol-Myers Squibb Announces Update on CheckMate -915 for Opdivo (nivolumab) Plus Yervoy (ipilimumab) Versus Opdivo Alone in Patients with Resected High-Risk Melanoma and PD-L1,"PRINCETON, N.J.--(BUSINESS WIRE)---- $BMY #BMS--Bristol-Myers Squibb Announces Topline Results for Opdivo Plus Yervoy Versus Opdivo Alone in Resected High-Risk Melanoma Patients",,https://www.businesswire.com/news/home/20191120005427/en/Bristol-Myers-Squibb-Announces-Update-CheckMate--915-Opdivo,Businesswire.com,,2019-11-20T12:07:17Z,-0.46
627816,LLY,Lilly announces $400 million capital investment in manufacturing facilities in Indianapolis,"INDIANAPOLIS, Nov. 20, 2019 /PRNewswire/ -- Eli Lilly and Company (NYSE: LLY) today announced plans to invest $400 million in its manufacturing facilities at its Lilly Technology Center campus in Indianapolis. The plans are driven by increasing demand for Lil…",,https://www.prnewswire.com/news-releases/lilly-announces-400-million-capital-investment-in-manufacturing-facilities-in-indianapolis-300961247.html,Prnewswire.com,,2019-11-20T11:30:00Z,-0.13
627932,PRGO,Perrigo appoints Wavemaker for European and Australian markets,Publicis Media previously handled business.,Gurjit Degun,https://www.campaignlive.co.uk/article/perrigo-appoints-wavemaker-european-australian-markets/1666332,Campaignlive.co.uk,,2019-11-20T11:07:37Z,0
627156,BMY,Celgene: Bargain Bin At Bristol-Myers Squibb Deal Closing,"Bristol-Myers expects to close the Celgene acquisition on November 20.The merger is immediately 40% accretive to BMY earnings placing 2020 estimates far above $6 per share.The stock only trades at 7.5x '21 EPS estimates suggesting investors immediately flip t…",Stone Fox Capital,https://seekingalpha.com/article/4307885-celgene-bargain-bin-bristol-myers-squibb-deal-closing,Seekingalpha.com,,2019-11-19T22:17:09Z,0.2
627252,LLY,Lilly Confirms Date and Conference Call for 2020 Financial Guidance Announcement,"INDIANAPOLIS, Nov. 19, 2019 /PRNewswire/ -- Eli Lilly and Company (NYSE: LLY) will announce its financial guidance for 2020 on Tuesday, December 17, 2019. Lilly will also conduct a conference call on that day with the investment community and media to further…",,https://prnmedia.prnewswire.com:443/news-releases/lilly-confirms-date-and-conference-call-for-2020-financial-guidance-announcement-300961328.html,Prnewswire.com,,2019-11-19T21:15:00Z,0
625787,ABBV,"Pfizer Gets FDA Approval for Biosimilar of AbbVie's Humira",The approval of Humira biosimilar is the fourth U.S. approval of a biosimilar product for Pfizer (PFE) in 2019.,Zacks Equity Research,https://finance.yahoo.com/news/pfizer-gets-fda-approval-biosimilar-152303398.html,Yahoo.com,,2019-11-19T15:23:03Z,0.85
625788,ABBV,Dividend Aristocrats And Credit Spreads,"Following the recent $30B mega bond deal for AbbVie, this article looks at bond spreads among fellow Dividend Aristocrats.
        Each of the Dividend Aristocrats is rated investment grade, and their average bond spread is meaningfully tighter than the IG co…",Ploutos,https://seekingalpha.com/article/4307696-dividend-aristocrats-credit-spreads,Seekingalpha.com,,2019-11-19T14:53:14Z,0.38
625789,ABBV,"Top Analyst Upgrades and Downgrades: AbbVie, AMD, AT&T, Broadcom, Energy Transfer, Ford, Fortinet, Intel, Intelsat, Shake Shack, T-Mobile and More","Tuesday's top analyst upgrades, downgrades and initiations included AbbVie, AMD, AT&T, Broadcom, Energy Transfer, Ford, Fortinet, Intel, Intelsat, Shake Shack and T-Mobile.",Jon C. Ogg,https://247wallst.com/investing/2019/11/19/top-analyst-upgrades-and-downgrades-abbvie-amd-att-broadcom-energy-transfer-ford-fortinet-intel-intelsat-shake-shack-t-mobile-and-more/,247wallst.com,,2019-11-19T13:59:36Z,0.53
625940,BMY,3 Reasons Growth Investors Will Love Bristol-Myers (BMY),Bristol-Myers (BMY) could produce exceptional returns because of its solid growth attributes.,Zacks Equity Research,https://finance.yahoo.com/news/3-reasons-growth-investors-love-134501603.html,Yahoo.com,,2019-11-19T13:45:01Z,0.88
625440,MRK,"FDA accepts Bioepis' application for Avastin biosimilar","The FDA accepts for review a marketing application from Samsung Bioepis Co., Ltd. for SB8, a biosimilar to Roche's (OTCQX:RHHBY) Avastin (bevacizumab).If approved, Merck (NYSE:MRK) will commercialize.",SA Editor Douglas W. House,https://seekingalpha.com/news/3520355-fda-accepts-bioepis-application-avastin-biosimilar,Seekingalpha.com,,2019-11-19T11:51:05Z,0.75
625318,BMY,Nektar: Poised For A Rebound,"Nektar and its partner (Bristol-Myers Squibb) are advancing NKTR-214 in the Phase 2 PIVOT trial in combinations with other immune checkpoint inhibitors for various cancers.The other potential blockbuster, NKTR-358, is being progressed into a Phase 1b trial fo…",BioSci Capital Partners,https://seekingalpha.com/article/4307652-nektar-poised-rebound,Seekingalpha.com,,2019-11-19T10:53:59Z,0.73
624284,BMY,ServiceNow stock up 4% on news it is joining the S&P 500,"ServiceNow Inc. will replace Celgene Corp. in the S&P 500 index before the open on Thursday, S&P Global said late Monday. Bristol-Myers Squibb Co. is acquiring Celgene in a deal expected to close soon. Lab equipment maker Thermo Fisher Scientific Inc. will jo…",Claudia Assis,https://www.marketwatch.com/story/servicenow-stock-up-4-on-news-it-is-joining-the-sp-500-2019-11-18,Marketwatch.com,,2019-11-18T22:58:39Z,0
623292,JNJ,"Should You Be Pleased About The CEO Pay At Johnson & Johnson's (NYSE:JNJ)","In 2012 Alex Gorsky was appointed CEO of Johnson & Johnson (NYSE:JNJ). This report will, first, examine the CEO...",Simply Wall St,https://finance.yahoo.com/news/pleased-ceo-pay-johnson-johnsons-161752715.html,Yahoo.com,,2019-11-18T16:17:52Z,0.36
623293,JNJ,J&J launches innovative study for expanded use of Invokana,"Johnson &amp; Johnson (JNJ) unit Janssen Pharmaceutical Companies, together with PRA Health Sciences (PRAH), initiates a first-of-its-kind clinical trial evaluating Invokana (canagliflozin) in adults",SA Editor Douglas W. House,https://seekingalpha.com/news/3520157-j-and-j-launches-innovative-study-expanded-use-invokana,Seekingalpha.com,,2019-11-18T16:05:18Z,0.44
622598,ABBV,"Pfizer scores FDA nod for biosim to AbbVie's Humira, but it'll have to wait til 2023 to launch","Pfizer has scored FDA approval for its biosimilar to AbbVie's megablockbuster Humira, but it can't launch the product for several years under a patent settlement the companies inked last year. Meanwhile, the company is planning some oncology biosimilar rollou…",Eric Sagonowsky,https://www.fiercepharma.com/pharma/pfizer-scores-fda-nod-for-biosim-to-abbvie-s-humira-but-it-ll-have-to-wait-til-2023-to,Fiercepharma.com,,2019-11-18T16:01:08Z,0.63
622599,ABBV,"What's $30B Among Friends?",AbbVie issued $30B of debt as part of the financing for its $63B acquisition of Allergan.The bond market readily received the supply with limited new issue concessions and the new bonds now trading through pre-deal spread levels.The success of this transactio…,Ploutos,https://seekingalpha.com/article/4307408-30b-among-friends,Seekingalpha.com,,2019-11-18T14:10:37Z,0.08
622884,BMY,Edited Transcript of BMY earnings conference call or presentation 31-Oct-19 12:30pm GMT,Q3 2019 Bristol-Myers Squibb Co Earnings Call,,https://finance.yahoo.com/news/edited-transcript-bmy-earnings-conference-135032117.html,Yahoo.com,,2019-11-18T13:50:32Z,0
622600,ABBV,AbbVie Announces Extension of Expiration Date for Exchange Offers for Allergan Notes,"NORTH CHICAGO, Ill., Nov. 18, 2019 /PRNewswire/ -- AbbVie Inc. (NYSE:ABBV) (""AbbVie"") announced today the extension of the expiration date of the offers to exchange (each, an ""Exchange Offer"" and, collectively, the ""Exchange Offers"") any and all outstanding n…",,https://www.prnewswire.com/news-releases/abbvie-announces-extension-of-expiration-date-for-exchange-offers-for-allergan-notes-300959740.html,Prnewswire.com,,2019-11-18T13:00:00Z,0.61
622602,ABBV,"AbbVie, Cigna and Other Health Care Stocks With Recent Golden Crosses","Here are five health-care-related stocks that recently saw their 50-day moving average cross above the 200-day average, a golden cross.",Trey Thoelcke,https://247wallst.com/healthcare-business/2019/11/18/abbvie-cigna-and-other-health-care-stocks-with-recent-golden-crosses/,247wallst.com,,2019-11-18T12:45:47Z,0.49
